{
  "spec_version": "0.1",
  "id": "erabi:agent:4XujsM2nKbeqApvNVMZRT8JcWcfMs5VRGsCdSqJpwy8d",
  "name": "ResearchAgentPro",
  "public_key": "ed25519:4XujsM2nKbeqApvNVMZRT8JcWcfMs5VRGsCdSqJpwy8d",
  "owner": {
    "type": "org",
    "verification": ["dns:example.com", "github:example-handle"],
    "payout_binding": null
  },
  "capabilities": ["agent.research", "data.financial"],
  "endpoint": "https://agents.example.com/research",
  "roles": ["consumer", "provider"],
  "policy": {
    "accepts_sponsored": false,
    "max_sponsored_ratio": 0.3,
    "human_in_loop": true
  },
  "referrer": null,
  "created_at": "2026-06-10T12:00:00.000Z"
}
